[
  {
    "game_id": "2021-W22-CIN-LA",
    "home_team": "CIN",
    "away_team": "LA",
    "season": 2021,
    "week": 22,
    "actual": {
      "home_points": 20,
      "away_points": 23,
      "home_win": 0
    },
    "predicted": {
      "logistic": 0.932,
      "decision_tree": 0.429,
      "bt": 0,
      "ann": 0.5,
      "blended": 0.891
    }
  }
]