[
  {
    "game_id": "2021-W08-ARI-GB",
    "home_team": "ARI",
    "away_team": "GB",
    "season": 2021,
    "week": 8,
    "actual": {
      "home_points": 21,
      "away_points": 24,
      "home_win": 0
    },
    "predicted": {
      "logistic": 0.937,
      "decision_tree": 0.902,
      "bt": 0,
      "ann": 0.5,
      "blended": 0.732
    }
  },
  {
    "game_id": "2021-W08-ATL-CAR",
    "home_team": "ATL",
    "away_team": "CAR",
    "season": 2021,
    "week": 8,
    "actual": {
      "home_points": 13,
      "away_points": 19,
      "home_win": 0
    },
    "predicted": {
      "logistic": 0.824,
      "decision_tree": 0.902,
      "bt": 0.986,
      "ann": 0.5,
      "blended": 0.844
    }
  },
  {
    "game_id": "2021-W08-BUF-MIA",
    "home_team": "BUF",
    "away_team": "MIA",
    "season": 2021,
    "week": 8,
    "actual": {
      "home_points": 26,
      "away_points": 11,
      "home_win": 1
    },
    "predicted": {
      "logistic": 0.915,
      "decision_tree": 0.455,
      "bt": 0.799,
      "ann": 0.5,
      "blended": 0.874
    }
  },
  {
    "game_id": "2021-W08-CHI-SF",
    "home_team": "CHI",
    "away_team": "SF",
    "season": 2021,
    "week": 8,
    "actual": {
      "home_points": 22,
      "away_points": 33,
      "home_win": 0
    },
    "predicted": {
      "logistic": 0.038,
      "decision_tree": 0.105,
      "bt": 0,
      "ann": 0.5,
      "blended": 0.054
    }
  },
  {
    "game_id": "2021-W08-CLE-PIT",
    "home_team": "CLE",
    "away_team": "PIT",
    "season": 2021,
    "week": 8,
    "actual": {
      "home_points": 10,
      "away_points": 15,
      "home_win": 0
    },
    "predicted": {
      "logistic": 0.033,
      "decision_tree": 0.105,
      "bt": 0.958,
      "ann": 0.5,
      "blended": 0.246
    }
  },
  {
    "game_id": "2021-W08-DET-PHI",
    "home_team": "DET",
    "away_team": "PHI",
    "season": 2021,
    "week": 8,
    "actual": {
      "home_points": 6,
      "away_points": 44,
      "home_win": 0
    },
    "predicted": {
      "logistic": 0.002,
      "decision_tree": 0.105,
      "bt": 0.001,
      "ann": 0.5,
      "blended": 0.027
    }
  },
  {
    "game_id": "2021-W08-HOU-LA",
    "home_team": "HOU",
    "away_team": "LA",
    "season": 2021,
    "week": 8,
    "actual": {
      "home_points": 22,
      "away_points": 38,
      "home_win": 0
    },
    "predicted": {
      "logistic": 0.273,
      "decision_tree": 0.25,
      "bt": 0.335,
      "ann": 0.5,
      "blended": 0.302
    }
  },
  {
    "game_id": "2021-W08-IND-TEN",
    "home_team": "IND",
    "away_team": "TEN",
    "season": 2021,
    "week": 8,
    "actual": {
      "home_points": 31,
      "away_points": 34,
      "home_win": 0
    },
    "predicted": {
      "logistic": 0.52,
      "decision_tree": 0.902,
      "bt": 0.987,
      "ann": 0.5,
      "blended": 0.618
    }
  },
  {
    "game_id": "2021-W08-NYJ-CIN",
    "home_team": "NYJ",
    "away_team": "CIN",
    "season": 2021,
    "week": 8,
    "actual": {
      "home_points": 34,
      "away_points": 31,
      "home_win": 1
    },
    "predicted": {
      "logistic": 0.799,
      "decision_tree": 0.25,
      "bt": 0,
      "ann": 0.5,
      "blended": 0.63
    }
  },
  {
    "game_id": "2021-W08-LAC-NE",
    "home_team": "LAC",
    "away_team": "NE",
    "season": 2021,
    "week": 8,
    "actual": {
      "home_points": 24,
      "away_points": 27,
      "home_win": 0
    },
    "predicted": {
      "logistic": 0.024,
      "decision_tree": 0.105,
      "bt": 0,
      "ann": 0.5,
      "blended": 0.044
    }
  },
  {
    "game_id": "2021-W08-SEA-JAX",
    "home_team": "SEA",
    "away_team": "JAX",
    "season": 2021,
    "week": 8,
    "actual": {
      "home_points": 31,
      "away_points": 7,
      "home_win": 1
    },
    "predicted": {
      "logistic": 0.702,
      "decision_tree": 0.81,
      "bt": 0.958,
      "ann": 0.5,
      "blended": 0.748
    }
  },
  {
    "game_id": "2021-W08-DEN-WAS",
    "home_team": "DEN",
    "away_team": "WAS",
    "season": 2021,
    "week": 8,
    "actual": {
      "home_points": 17,
      "away_points": 10,
      "home_win": 1
    },
    "predicted": {
      "logistic": 0.484,
      "decision_tree": 0.105,
      "bt": 0,
      "ann": 0.5,
      "blended": 0.394
    }
  },
  {
    "game_id": "2021-W08-NO-TB",
    "home_team": "NO",
    "away_team": "TB",
    "season": 2021,
    "week": 8,
    "actual": {
      "home_points": 36,
      "away_points": 27,
      "home_win": 1
    },
    "predicted": {
      "logistic": 0.144,
      "decision_tree": 0.105,
      "bt": 0.018,
      "ann": 0.5,
      "blended": 0.14
    }
  },
  {
    "game_id": "2021-W08-MIN-DAL",
    "home_team": "MIN",
    "away_team": "DAL",
    "season": 2021,
    "week": 8,
    "actual": {
      "home_points": 16,
      "away_points": 20,
      "home_win": 0
    },
    "predicted": {
      "logistic": 0.022,
      "decision_tree": 0.81,
      "bt": 1,
      "ann": 0.5,
      "blended": 0.246
    }
  },
  {
    "game_id": "2021-W08-KC-NYG",
    "home_team": "KC",
    "away_team": "NYG",
    "season": 2021,
    "week": 8,
    "actual": {
      "home_points": 20,
      "away_points": 17,
      "home_win": 1
    },
    "predicted": {
      "logistic": 0.432,
      "decision_tree": 0.105,
      "bt": 0.463,
      "ann": 0.5,
      "blended": 0.448
    }
  }
]