[{"game_id":"2001-W19-CHI-PHI","home_team":"CHI","away_team":"PHI","season":2001,"week":19,"actual":{"home_points":19,"away_points":33,"home_win":0},"predicted":{"logistic":0.001,"decision_tree":0.051,"bt":0.555,"ann":0.715,"blended":0.075}},{"game_id":"2001-W19-PIT-BAL","home_team":"PIT","away_team":"BAL","season":2001,"week":19,"actual":{"home_points":27,"away_points":10,"home_win":1},"predicted":{"logistic":0.001,"decision_tree":0.817,"bt":0.687,"ann":0.789,"blended":0.083}}]