[{"game_id":"2012-W04-BAL-CLE","home_team":"BAL","away_team":"CLE","season":2012,"week":4,"actual":{"home_points":23,"away_points":16,"home_win":1},"predicted":{"logistic":0.993,"decision_tree":0.389,"bt":0.516,"ann":0.596,"blended":0.983}},{"game_id":"2012-W04-ATL-CAR","home_team":"ATL","away_team":"CAR","season":2012,"week":4,"actual":{"home_points":30,"away_points":28,"home_win":1},"predicted":{"logistic":0.989,"decision_tree":0.389,"bt":0.568,"ann":0.698,"blended":0.984}},{"game_id":"2012-W04-BUF-NE","home_team":"BUF","away_team":"NE","season":2012,"week":4,"actual":{"home_points":28,"away_points":52,"home_win":0},"predicted":{"logistic":0.008,"decision_tree":0.389,"bt":0.566,"ann":0.297,"blended":0.039}},{"game_id":"2012-W04-DET-MIN","home_team":"DET","away_team":"MIN","season":2012,"week":4,"actual":{"home_points":13,"away_points":20,"home_win":0},"predicted":{"logistic":0.057,"decision_tree":0.389,"bt":0.49,"ann":0.342,"blended":0.116}},{"game_id":"2012-W04-HOU-TEN","home_team":"HOU","away_team":"TEN","season":2012,"week":4,"actual":{"home_points":38,"away_points":14,"home_win":1},"predicted":{"logistic":0.999,"decision_tree":0.389,"bt":0.551,"ann":0.742,"blended":0.991}},{"game_id":"2012-W04-NYJ-SF","home_team":"NYJ","away_team":"SF","season":2012,"week":4,"actual":{"home_points":0,"away_points":34,"home_win":0},"predicted":{"logistic":0,"decision_tree":0.389,"bt":0.516,"ann":0.309,"blended":0.027}},{"game_id":"2012-W04-ARI-MIA","home_team":"ARI","away_team":"MIA","season":2012,"week":4,"actual":{"home_points":24,"away_points":21,"home_win":1},"predicted":{"logistic":0.996,"decision_tree":0.389,"bt":0.545,"ann":0.735,"blended":0.989}},{"game_id":"2012-W04-GB-NO","home_team":"GB","away_team":"NO","season":2012,"week":4,"actual":{"home_points":28,"away_points":27,"home_win":1},"predicted":{"logistic":0.999,"decision_tree":0.389,"bt":0.53,"ann":0.66,"blended":0.988}},{"game_id":"2012-W04-TB-WAS","home_team":"TB","away_team":"WAS","season":2012,"week":4,"actual":{"home_points":22,"away_points":24,"home_win":0},"predicted":{"logistic":0.001,"decision_tree":0.389,"bt":0.601,"ann":0.464,"blended":0.041}},{"game_id":"2012-W04-PHI-NYG","home_team":"PHI","away_team":"NYG","season":2012,"week":4,"actual":{"home_points":19,"away_points":17,"home_win":1},"predicted":{"logistic":0.919,"decision_tree":0.389,"bt":0.499,"ann":0.529,"blended":0.937}},{"game_id":"2012-W04-DAL-CHI","home_team":"DAL","away_team":"CHI","season":2012,"week":4,"actual":{"home_points":18,"away_points":34,"home_win":0},"predicted":{"logistic":0,"decision_tree":0.389,"bt":0.514,"ann":0.319,"blended":0.028}}]