[{"game_id":"2015-W19-NE-KC","home_team":"NE","away_team":"KC","season":2015,"week":19,"actual":{"home_points":27,"away_points":20,"home_win":1},"predicted":{"logistic":0.002,"decision_tree":0.966,"bt":0.348,"ann":0.643,"blended":0.213}},{"game_id":"2015-W19-ARI-GB","home_team":"ARI","away_team":"GB","season":2015,"week":19,"actual":{"home_points":26,"away_points":20,"home_win":1},"predicted":{"logistic":0.003,"decision_tree":0.966,"bt":0.531,"ann":0.77,"blended":0.226}},{"game_id":"2015-W19-CAR-SEA","home_team":"CAR","away_team":"SEA","season":2015,"week":19,"actual":{"home_points":31,"away_points":24,"home_win":1},"predicted":{"logistic":0,"decision_tree":0.966,"bt":0.315,"ann":0.77,"blended":0.224}},{"game_id":"2015-W19-DEN-PIT","home_team":"DEN","away_team":"PIT","season":2015,"week":19,"actual":{"home_points":23,"away_points":16,"home_win":1},"predicted":{"logistic":0.01,"decision_tree":0.966,"bt":0.399,"ann":0.737,"blended":0.228}}]