[{"game_id":"2013-W10-MIN-WAS","home_team":"MIN","away_team":"WAS","season":2013,"week":10,"actual":{"home_points":34,"away_points":27,"home_win":1},"predicted":{"logistic":0.964,"decision_tree":0.75,"bt":0.613,"ann":0.161,"blended":0.898}},{"game_id":"2013-W10-ATL-SEA","home_team":"ATL","away_team":"SEA","season":2013,"week":10,"actual":{"home_points":10,"away_points":33,"home_win":0},"predicted":{"logistic":0.397,"decision_tree":0.75,"bt":0.407,"ann":0.234,"blended":0.415}},{"game_id":"2013-W10-BAL-CIN","home_team":"BAL","away_team":"CIN","season":2013,"week":10,"actual":{"home_points":20,"away_points":17,"home_win":1},"predicted":{"logistic":0.991,"decision_tree":0.95,"bt":0.408,"ann":0.522,"blended":0.951}},{"game_id":"2013-W10-CHI-DET","home_team":"CHI","away_team":"DET","season":2013,"week":10,"actual":{"home_points":19,"away_points":21,"home_win":0},"predicted":{"logistic":0.039,"decision_tree":0.857,"bt":0.7,"ann":0.583,"blended":0.107}},{"game_id":"2013-W10-GB-PHI","home_team":"GB","away_team":"PHI","season":2013,"week":10,"actual":{"home_points":13,"away_points":27,"home_win":0},"predicted":{"logistic":0.499,"decision_tree":0.182,"bt":0.595,"ann":0.645,"blended":0.55}},{"game_id":"2013-W10-PIT-BUF","home_team":"PIT","away_team":"BUF","season":2013,"week":10,"actual":{"home_points":23,"away_points":10,"home_win":1},"predicted":{"logistic":0.999,"decision_tree":0.182,"bt":0.455,"ann":0.478,"blended":0.954}},{"game_id":"2013-W10-SF-CAR","home_team":"SF","away_team":"CAR","season":2013,"week":10,"actual":{"home_points":9,"away_points":10,"home_win":0},"predicted":{"logistic":0.009,"decision_tree":0.074,"bt":0.398,"ann":0.772,"blended":0.098}},{"game_id":"2013-W10-ARI-HOU","home_team":"ARI","away_team":"HOU","season":2013,"week":10,"actual":{"home_points":27,"away_points":24,"home_win":1},"predicted":{"logistic":0.861,"decision_tree":0.95,"bt":0.634,"ann":0.568,"blended":0.852}},{"game_id":"2013-W10-NO-DAL","home_team":"NO","away_team":"DAL","season":2013,"week":10,"actual":{"home_points":49,"away_points":17,"home_win":1},"predicted":{"logistic":0.616,"decision_tree":0.95,"bt":0.453,"ann":0.694,"blended":0.658}},{"game_id":"2013-W10-TB-MIA","home_team":"TB","away_team":"MIA","season":2013,"week":10,"actual":{"home_points":22,"away_points":19,"home_win":1},"predicted":{"logistic":0.918,"decision_tree":0.75,"bt":0.45,"ann":0.192,"blended":0.864}}]