[{"game_id":"2012-W17-ATL-TB","home_team":"ATL","away_team":"TB","season":2012,"week":17,"actual":{"home_points":17,"away_points":22,"home_win":0},"predicted":{"logistic":0.165,"decision_tree":0.861,"bt":0.492,"ann":0.705,"blended":0.19}},{"game_id":"2012-W17-BUF-NYJ","home_team":"BUF","away_team":"NYJ","season":2012,"week":17,"actual":{"home_points":28,"away_points":9,"home_win":1},"predicted":{"logistic":0.31,"decision_tree":0.049,"bt":0.576,"ann":0.3,"blended":0.273}},{"game_id":"2012-W17-CIN-BAL","home_team":"CIN","away_team":"BAL","season":2012,"week":17,"actual":{"home_points":23,"away_points":17,"home_win":1},"predicted":{"logistic":0.947,"decision_tree":0.049,"bt":0.337,"ann":0.584,"blended":0.895}},{"game_id":"2012-W17-DET-CHI","home_team":"DET","away_team":"CHI","season":2012,"week":17,"actual":{"home_points":24,"away_points":26,"home_win":0},"predicted":{"logistic":0.001,"decision_tree":0.049,"bt":0.648,"ann":0.274,"blended":0.024}},{"game_id":"2012-W17-IND-HOU","home_team":"IND","away_team":"HOU","season":2012,"week":17,"actual":{"home_points":28,"away_points":16,"home_win":1},"predicted":{"logistic":0.997,"decision_tree":0.333,"bt":0.571,"ann":0.53,"blended":0.941}},{"game_id":"2012-W17-NO-CAR","home_team":"NO","away_team":"CAR","season":2012,"week":17,"actual":{"home_points":38,"away_points":44,"home_win":0},"predicted":{"logistic":0.78,"decision_tree":0.667,"bt":0.495,"ann":0.46,"blended":0.713}},{"game_id":"2012-W17-NYG-PHI","home_team":"NYG","away_team":"PHI","season":2012,"week":17,"actual":{"home_points":42,"away_points":7,"home_win":1},"predicted":{"logistic":0.898,"decision_tree":0.861,"bt":0.624,"ann":0.778,"blended":0.867}},{"game_id":"2012-W17-PIT-CLE","home_team":"PIT","away_team":"CLE","season":2012,"week":17,"actual":{"home_points":24,"away_points":10,"home_win":1},"predicted":{"logistic":0.791,"decision_tree":0.049,"bt":0.676,"ann":0.417,"blended":0.719}},{"game_id":"2012-W17-DEN-KC","home_team":"DEN","away_team":"KC","season":2012,"week":17,"actual":{"home_points":38,"away_points":3,"home_win":1},"predicted":{"logistic":1,"decision_tree":0.688,"bt":0.612,"ann":0.712,"blended":0.965}},{"game_id":"2012-W17-MIN-GB","home_team":"MIN","away_team":"GB","season":2012,"week":17,"actual":{"home_points":37,"away_points":34,"home_win":1},"predicted":{"logistic":0.863,"decision_tree":0.176,"bt":0.356,"ann":0.568,"blended":0.807}},{"game_id":"2012-W17-NE-MIA","home_team":"NE","away_team":"MIA","season":2012,"week":17,"actual":{"home_points":28,"away_points":0,"home_win":1},"predicted":{"logistic":0.99,"decision_tree":0.688,"bt":0.585,"ann":0.732,"blended":0.958}},{"game_id":"2012-W17-SF-ARI","home_team":"SF","away_team":"ARI","season":2012,"week":17,"actual":{"home_points":27,"away_points":13,"home_win":1},"predicted":{"logistic":0.432,"decision_tree":0.176,"bt":0.556,"ann":0.76,"blended":0.42}},{"game_id":"2012-W17-WAS-DAL","home_team":"WAS","away_team":"DAL","season":2012,"week":17,"actual":{"home_points":28,"away_points":18,"home_win":1},"predicted":{"logistic":1,"decision_tree":0.961,"bt":0.603,"ann":0.769,"blended":0.972}}]