[{"game_id":"2013-W18-IND-KC","home_team":"IND","away_team":"KC","season":2013,"week":18,"actual":{"home_points":45,"away_points":44,"home_win":1},"predicted":{"logistic":0.978,"decision_tree":0.842,"bt":0.585,"ann":0.811,"blended":0.96}},{"game_id":"2013-W18-PHI-NO","home_team":"PHI","away_team":"NO","season":2013,"week":18,"actual":{"home_points":24,"away_points":26,"home_win":0},"predicted":{"logistic":0.673,"decision_tree":0.769,"bt":0.568,"ann":0.801,"blended":0.682}},{"game_id":"2013-W18-GB-SF","home_team":"GB","away_team":"SF","season":2013,"week":18,"actual":{"home_points":20,"away_points":23,"home_win":0},"predicted":{"logistic":0.099,"decision_tree":0.333,"bt":0.458,"ann":0.474,"blended":0.134}}]