[
  {
    "game_id": "2024-W21-PHI-WAS",
    "home_team": "PHI",
    "away_team": "WAS",
    "season": 2024,
    "week": 21,
    "actual": {
      "home_points": 55,
      "away_points": 23,
      "home_win": 1
    },
    "predicted": {
      "logistic": 0.999,
      "decision_tree": 0.877,
      "bt": 0.808,
      "ann": 0.502,
      "blended": 0.966
    }
  },
  {
    "game_id": "2024-W21-KC-BUF",
    "home_team": "KC",
    "away_team": "BUF",
    "season": 2024,
    "week": 21,
    "actual": {
      "home_points": 32,
      "away_points": 29,
      "home_win": 1
    },
    "predicted": {
      "logistic": 0.347,
      "decision_tree": 0.857,
      "bt": 0.682,
      "ann": 0.502,
      "blended": 0.438
    }
  }
]