[
  {
    "game_id": "2024-W01-KC-BAL",
    "home_team": "KC",
    "away_team": "BAL",
    "season": 2024,
    "week": 1,
    "actual": {
      "home_points": 27,
      "away_points": 20,
      "home_win": 1
    },
    "predicted": {
      "logistic": 0.5,
      "decision_tree": 0.5,
      "bt": 0.5,
      "ann": 0.5,
      "blended": 0.5
    }
  },
  {
    "game_id": "2024-W01-PHI-GB",
    "home_team": "PHI",
    "away_team": "GB",
    "season": 2024,
    "week": 1,
    "actual": {
      "home_points": 34,
      "away_points": 29,
      "home_win": 1
    },
    "predicted": {
      "logistic": 0.5,
      "decision_tree": 0.5,
      "bt": 0.5,
      "ann": 0.5,
      "blended": 0.5
    }
  },
  {
    "game_id": "2024-W01-ATL-PIT",
    "home_team": "ATL",
    "away_team": "PIT",
    "season": 2024,
    "week": 1,
    "actual": {
      "home_points": 10,
      "away_points": 18,
      "home_win": 0
    },
    "predicted": {
      "logistic": 0.5,
      "decision_tree": 0.5,
      "bt": 0.5,
      "ann": 0.5,
      "blended": 0.5
    }
  },
  {
    "game_id": "2024-W01-BUF-ARI",
    "home_team": "BUF",
    "away_team": "ARI",
    "season": 2024,
    "week": 1,
    "actual": {
      "home_points": 34,
      "away_points": 28,
      "home_win": 1
    },
    "predicted": {
      "logistic": 0.5,
      "decision_tree": 0.5,
      "bt": 0.5,
      "ann": 0.5,
      "blended": 0.5
    }
  },
  {
    "game_id": "2024-W01-CHI-TEN",
    "home_team": "CHI",
    "away_team": "TEN",
    "season": 2024,
    "week": 1,
    "actual": {
      "home_points": 24,
      "away_points": 17,
      "home_win": 1
    },
    "predicted": {
      "logistic": 0.5,
      "decision_tree": 0.5,
      "bt": 0.5,
      "ann": 0.5,
      "blended": 0.5
    }
  },
  {
    "game_id": "2024-W01-CIN-NE",
    "home_team": "CIN",
    "away_team": "NE",
    "season": 2024,
    "week": 1,
    "actual": {
      "home_points": 10,
      "away_points": 16,
      "home_win": 0
    },
    "predicted": {
      "logistic": 0.5,
      "decision_tree": 0.5,
      "bt": 0.5,
      "ann": 0.5,
      "blended": 0.5
    }
  },
  {
    "game_id": "2024-W01-IND-HOU",
    "home_team": "IND",
    "away_team": "HOU",
    "season": 2024,
    "week": 1,
    "actual": {
      "home_points": 27,
      "away_points": 29,
      "home_win": 0
    },
    "predicted": {
      "logistic": 0.5,
      "decision_tree": 0.5,
      "bt": 0.5,
      "ann": 0.5,
      "blended": 0.5
    }
  },
  {
    "game_id": "2024-W01-MIA-JAX",
    "home_team": "MIA",
    "away_team": "JAX",
    "season": 2024,
    "week": 1,
    "actual": {
      "home_points": 20,
      "away_points": 17,
      "home_win": 1
    },
    "predicted": {
      "logistic": 0.5,
      "decision_tree": 0.5,
      "bt": 0.5,
      "ann": 0.5,
      "blended": 0.5
    }
  },
  {
    "game_id": "2024-W01-NO-CAR",
    "home_team": "NO",
    "away_team": "CAR",
    "season": 2024,
    "week": 1,
    "actual": {
      "home_points": 47,
      "away_points": 10,
      "home_win": 1
    },
    "predicted": {
      "logistic": 0.5,
      "decision_tree": 0.5,
      "bt": 0.5,
      "ann": 0.5,
      "blended": 0.5
    }
  },
  {
    "game_id": "2024-W01-NYG-MIN",
    "home_team": "NYG",
    "away_team": "MIN",
    "season": 2024,
    "week": 1,
    "actual": {
      "home_points": 6,
      "away_points": 28,
      "home_win": 0
    },
    "predicted": {
      "logistic": 0.5,
      "decision_tree": 0.5,
      "bt": 0.5,
      "ann": 0.5,
      "blended": 0.5
    }
  },
  {
    "game_id": "2024-W01-LAC-LV",
    "home_team": "LAC",
    "away_team": "LV",
    "season": 2024,
    "week": 1,
    "actual": {
      "home_points": 22,
      "away_points": 10,
      "home_win": 1
    },
    "predicted": {
      "logistic": 0.5,
      "decision_tree": 0.5,
      "bt": 0.5,
      "ann": 0.5,
      "blended": 0.5
    }
  },
  {
    "game_id": "2024-W01-SEA-DEN",
    "home_team": "SEA",
    "away_team": "DEN",
    "season": 2024,
    "week": 1,
    "actual": {
      "home_points": 26,
      "away_points": 20,
      "home_win": 1
    },
    "predicted": {
      "logistic": 0.5,
      "decision_tree": 0.5,
      "bt": 0.5,
      "ann": 0.5,
      "blended": 0.5
    }
  },
  {
    "game_id": "2024-W01-CLE-DAL",
    "home_team": "CLE",
    "away_team": "DAL",
    "season": 2024,
    "week": 1,
    "actual": {
      "home_points": 17,
      "away_points": 33,
      "home_win": 0
    },
    "predicted": {
      "logistic": 0.5,
      "decision_tree": 0.5,
      "bt": 0.5,
      "ann": 0.5,
      "blended": 0.5
    }
  },
  {
    "game_id": "2024-W01-TB-WAS",
    "home_team": "TB",
    "away_team": "WAS",
    "season": 2024,
    "week": 1,
    "actual": {
      "home_points": 37,
      "away_points": 20,
      "home_win": 1
    },
    "predicted": {
      "logistic": 0.5,
      "decision_tree": 0.5,
      "bt": 0.5,
      "ann": 0.5,
      "blended": 0.5
    }
  },
  {
    "game_id": "2024-W01-DET-LA",
    "home_team": "DET",
    "away_team": "LA",
    "season": 2024,
    "week": 1,
    "actual": {
      "home_points": 26,
      "away_points": 20,
      "home_win": 1
    },
    "predicted": {
      "logistic": 0.5,
      "decision_tree": 0.5,
      "bt": 0.5,
      "ann": 0.5,
      "blended": 0.5
    }
  },
  {
    "game_id": "2024-W01-SF-NYJ",
    "home_team": "SF",
    "away_team": "NYJ",
    "season": 2024,
    "week": 1,
    "actual": {
      "home_points": 32,
      "away_points": 19,
      "home_win": 1
    },
    "predicted": {
      "logistic": 0.5,
      "decision_tree": 0.5,
      "bt": 0.5,
      "ann": 0.5,
      "blended": 0.5
    }
  }
]