[{"game_id":"2011-W04-CHI-CAR","home_team":"CHI","away_team":"CAR","season":2011,"week":4,"actual":{"home_points":34,"away_points":29,"home_win":1},"predicted":{"logistic":0.984,"decision_tree":0.462,"bt":0.424,"ann":0.542,"blended":0.98}},{"game_id":"2011-W04-CIN-BUF","home_team":"CIN","away_team":"BUF","season":2011,"week":4,"actual":{"home_points":23,"away_points":20,"home_win":1},"predicted":{"logistic":0.972,"decision_tree":0.804,"bt":0.47,"ann":0.581,"blended":0.975}},{"game_id":"2011-W04-CLE-TEN","home_team":"CLE","away_team":"TEN","season":2011,"week":4,"actual":{"home_points":13,"away_points":31,"home_win":0},"predicted":{"logistic":0.002,"decision_tree":0.804,"bt":0.438,"ann":0.647,"blended":0.069}},{"game_id":"2011-W04-DAL-DET","home_team":"DAL","away_team":"DET","season":2011,"week":4,"actual":{"home_points":30,"away_points":34,"home_win":0},"predicted":{"logistic":0.001,"decision_tree":0.804,"bt":0.533,"ann":0.59,"blended":0.062}},{"game_id":"2011-W04-HOU-PIT","home_team":"HOU","away_team":"PIT","season":2011,"week":4,"actual":{"home_points":17,"away_points":10,"home_win":1},"predicted":{"logistic":1,"decision_tree":0.804,"bt":0.497,"ann":0.626,"blended":0.99}},{"game_id":"2011-W04-KC-MIN","home_team":"KC","away_team":"MIN","season":2011,"week":4,"actual":{"home_points":22,"away_points":17,"home_win":1},"predicted":{"logistic":0.966,"decision_tree":0.5,"bt":0.513,"ann":0.44,"blended":0.968}},{"game_id":"2011-W04-PHI-SF","home_team":"PHI","away_team":"SF","season":2011,"week":4,"actual":{"home_points":23,"away_points":24,"home_win":0},"predicted":{"logistic":0.059,"decision_tree":0.5,"bt":0.643,"ann":0.552,"blended":0.156}},{"game_id":"2011-W04-ARI-NYG","home_team":"ARI","away_team":"NYG","season":2011,"week":4,"actual":{"home_points":27,"away_points":31,"home_win":0},"predicted":{"logistic":0.209,"decision_tree":0.5,"bt":0.553,"ann":0.539,"blended":0.369}},{"game_id":"2011-W04-SEA-ATL","home_team":"SEA","away_team":"ATL","season":2011,"week":4,"actual":{"home_points":28,"away_points":30,"home_win":0},"predicted":{"logistic":0.045,"decision_tree":0.5,"bt":0.447,"ann":0.465,"blended":0.126}},{"game_id":"2011-W04-GB-DEN","home_team":"GB","away_team":"DEN","season":2011,"week":4,"actual":{"home_points":49,"away_points":23,"home_win":1},"predicted":{"logistic":0.994,"decision_tree":0.804,"bt":0.615,"ann":0.702,"blended":0.989}},{"game_id":"2011-W04-BAL-NYJ","home_team":"BAL","away_team":"NYJ","season":2011,"week":4,"actual":{"home_points":34,"away_points":17,"home_win":1},"predicted":{"logistic":0.992,"decision_tree":0.804,"bt":0.526,"ann":0.638,"blended":0.986}},{"game_id":"2011-W04-TB-IND","home_team":"TB","away_team":"IND","season":2011,"week":4,"actual":{"home_points":24,"away_points":17,"home_win":1},"predicted":{"logistic":0.992,"decision_tree":0.804,"bt":0.576,"ann":0.663,"blended":0.987}}]