[{"game_id":"2009-W17-BUF-IND","home_team":"BUF","away_team":"IND","season":2009,"week":17,"actual":{"home_points":30,"away_points":7,"home_win":1},"predicted":{"logistic":0.638,"decision_tree":0.08,"bt":0.334,"ann":0.459,"blended":0.595}},{"game_id":"2009-W17-CAR-NO","home_team":"CAR","away_team":"NO","season":2009,"week":17,"actual":{"home_points":23,"away_points":10,"home_win":1},"predicted":{"logistic":0.975,"decision_tree":0.75,"bt":0.492,"ann":0.634,"blended":0.935}},{"game_id":"2009-W17-DET-CHI","home_team":"DET","away_team":"CHI","season":2009,"week":17,"actual":{"home_points":23,"away_points":37,"home_win":0},"predicted":{"logistic":0.032,"decision_tree":0.08,"bt":0.497,"ann":0.177,"blended":0.042}},{"game_id":"2009-W17-HOU-NE","home_team":"HOU","away_team":"NE","season":2009,"week":17,"actual":{"home_points":34,"away_points":27,"home_win":1},"predicted":{"logistic":0.776,"decision_tree":0.214,"bt":0.606,"ann":0.639,"blended":0.743}},{"game_id":"2009-W17-MIA-PIT","home_team":"MIA","away_team":"PIT","season":2009,"week":17,"actual":{"home_points":24,"away_points":30,"home_win":0},"predicted":{"logistic":0.008,"decision_tree":0.154,"bt":0.533,"ann":0.378,"blended":0.041}},{"game_id":"2009-W17-MIN-NYG","home_team":"MIN","away_team":"NYG","season":2009,"week":17,"actual":{"home_points":44,"away_points":7,"home_win":1},"predicted":{"logistic":0.53,"decision_tree":0.75,"bt":0.725,"ann":0.594,"blended":0.51}},{"game_id":"2009-W17-TB-ATL","home_team":"TB","away_team":"ATL","season":2009,"week":17,"actual":{"home_points":10,"away_points":20,"home_win":0},"predicted":{"logistic":0.887,"decision_tree":0.909,"bt":0.308,"ann":0.24,"blended":0.807}},{"game_id":"2009-W17-ARI-GB","home_team":"ARI","away_team":"GB","season":2009,"week":17,"actual":{"home_points":7,"away_points":33,"home_win":0},"predicted":{"logistic":0.244,"decision_tree":0.75,"bt":0.375,"ann":0.489,"blended":0.248}},{"game_id":"2009-W17-DAL-PHI","home_team":"DAL","away_team":"PHI","season":2009,"week":17,"actual":{"home_points":24,"away_points":0,"home_win":1},"predicted":{"logistic":0.778,"decision_tree":0.75,"bt":0.53,"ann":0.708,"blended":0.753}},{"game_id":"2009-W17-DEN-KC","home_team":"DEN","away_team":"KC","season":2009,"week":17,"actual":{"home_points":24,"away_points":44,"home_win":0},"predicted":{"logistic":0.001,"decision_tree":0.909,"bt":0.765,"ann":0.355,"blended":0.033}},{"game_id":"2009-W17-SEA-TEN","home_team":"SEA","away_team":"TEN","season":2009,"week":17,"actual":{"home_points":13,"away_points":17,"home_win":0},"predicted":{"logistic":0.005,"decision_tree":0.08,"bt":0.446,"ann":0.197,"blended":0.022}},{"game_id":"2009-W17-NYJ-CIN","home_team":"NYJ","away_team":"CIN","season":2009,"week":17,"actual":{"home_points":37,"away_points":0,"home_win":1},"predicted":{"logistic":0.97,"decision_tree":0.75,"bt":0.313,"ann":0.646,"blended":0.931}}]