[{"game_id":"2016-W10-BAL-CLE","home_team":"BAL","away_team":"CLE","season":2016,"week":10,"actual":{"home_points":28,"away_points":7,"home_win":1},"predicted":{"logistic":1,"decision_tree":0.5,"bt":0.716,"ann":0.711,"blended":0.978}},{"game_id":"2016-W10-CAR-KC","home_team":"CAR","away_team":"KC","season":2016,"week":10,"actual":{"home_points":17,"away_points":20,"home_win":0},"predicted":{"logistic":0.993,"decision_tree":0.962,"bt":0.539,"ann":0.335,"blended":0.944}},{"game_id":"2016-W10-NO-DEN","home_team":"NO","away_team":"DEN","season":2016,"week":10,"actual":{"home_points":23,"away_points":25,"home_win":0},"predicted":{"logistic":0.975,"decision_tree":0.962,"bt":0.679,"ann":0.707,"blended":0.96}},{"game_id":"2016-W10-PHI-ATL","home_team":"PHI","away_team":"ATL","season":2016,"week":10,"actual":{"home_points":24,"away_points":15,"home_win":1},"predicted":{"logistic":0.62,"decision_tree":0.962,"bt":0.434,"ann":0.696,"blended":0.689}},{"game_id":"2016-W10-TB-CHI","home_team":"TB","away_team":"CHI","season":2016,"week":10,"actual":{"home_points":36,"away_points":10,"home_win":1},"predicted":{"logistic":0.91,"decision_tree":0.154,"bt":0.812,"ann":0.403,"blended":0.889}},{"game_id":"2016-W10-TEN-GB","home_team":"TEN","away_team":"GB","season":2016,"week":10,"actual":{"home_points":47,"away_points":25,"home_win":1},"predicted":{"logistic":0.982,"decision_tree":0.882,"bt":0.534,"ann":0.536,"blended":0.951}},{"game_id":"2016-W10-WAS-MIN","home_team":"WAS","away_team":"MIN","season":2016,"week":10,"actual":{"home_points":26,"away_points":20,"home_win":1},"predicted":{"logistic":0.184,"decision_tree":0.882,"bt":0.637,"ann":0.539,"blended":0.269}},{"game_id":"2016-W10-ARI-SF","home_team":"ARI","away_team":"SF","season":2016,"week":10,"actual":{"home_points":23,"away_points":20,"home_win":1},"predicted":{"logistic":0.991,"decision_tree":0.429,"bt":0.868,"ann":0.389,"blended":0.946}},{"game_id":"2016-W10-PIT-DAL","home_team":"PIT","away_team":"DAL","season":2016,"week":10,"actual":{"home_points":30,"away_points":35,"home_win":0},"predicted":{"logistic":0.034,"decision_tree":0.08,"bt":0.597,"ann":0.322,"blended":0.081}},{"game_id":"2016-W10-NE-SEA","home_team":"NE","away_team":"SEA","season":2016,"week":10,"actual":{"home_points":24,"away_points":31,"home_win":0},"predicted":{"logistic":0,"decision_tree":0.08,"bt":0.752,"ann":0.501,"blended":0.065}},{"game_id":"2016-W10-NYG-CIN","home_team":"NYG","away_team":"CIN","season":2016,"week":10,"actual":{"home_points":21,"away_points":20,"home_win":1},"predicted":{"logistic":0.262,"decision_tree":0.6,"bt":0.394,"ann":0.739,"blended":0.37}}]