[{"game_id":"2013-W20-DEN-NE","home_team":"DEN","away_team":"NE","season":2013,"week":20,"actual":{"home_points":26,"away_points":16,"home_win":1},"predicted":{"logistic":0.081,"decision_tree":0.957,"bt":0.422,"ann":0.799,"blended":0.155}},{"game_id":"2013-W20-SEA-SF","home_team":"SEA","away_team":"SF","season":2013,"week":20,"actual":{"home_points":23,"away_points":17,"home_win":1},"predicted":{"logistic":0.617,"decision_tree":0.957,"bt":0.613,"ann":0.788,"blended":0.638}}]