[{"game_id":"2002-W17-NYG-PHI","home_team":"NYG","away_team":"PHI","season":2002,"week":17,"actual":{"home_points":10,"away_points":7,"home_win":1},"predicted":{"logistic":0.984,"decision_tree":0.81,"bt":0.498,"ann":0.787,"blended":0.966}},{"game_id":"2002-W17-BUF-CIN","home_team":"BUF","away_team":"CIN","season":2002,"week":17,"actual":{"home_points":27,"away_points":9,"home_win":1},"predicted":{"logistic":0.864,"decision_tree":0.92,"bt":0.582,"ann":0.751,"blended":0.859}},{"game_id":"2002-W17-CLE-ATL","home_team":"CLE","away_team":"ATL","season":2002,"week":17,"actual":{"home_points":24,"away_points":16,"home_win":1},"predicted":{"logistic":0.869,"decision_tree":0.15,"bt":0.399,"ann":0.711,"blended":0.86}},{"game_id":"2002-W17-DET-MIN","home_team":"DET","away_team":"MIN","season":2002,"week":17,"actual":{"home_points":36,"away_points":38,"home_win":0},"predicted":{"logistic":0.007,"decision_tree":0.15,"bt":0.592,"ann":0.182,"blended":0.026}},{"game_id":"2002-W17-HOU-TEN","home_team":"HOU","away_team":"TEN","season":2002,"week":17,"actual":{"home_points":3,"away_points":13,"home_win":0},"predicted":{"logistic":0.019,"decision_tree":0.2,"bt":0.687,"ann":0.295,"blended":0.049}},{"game_id":"2002-W17-NE-MIA","home_team":"NE","away_team":"MIA","season":2002,"week":17,"actual":{"home_points":27,"away_points":24,"home_win":1},"predicted":{"logistic":0.694,"decision_tree":0.15,"bt":0.495,"ann":0.608,"blended":0.697}},{"game_id":"2002-W17-NO-CAR","home_team":"NO","away_team":"CAR","season":2002,"week":17,"actual":{"home_points":6,"away_points":10,"home_win":0},"predicted":{"logistic":0.02,"decision_tree":0.478,"bt":0.712,"ann":0.613,"blended":0.083}},{"game_id":"2002-W17-PIT-BAL","home_team":"PIT","away_team":"BAL","season":2002,"week":17,"actual":{"home_points":34,"away_points":31,"home_win":1},"predicted":{"logistic":0.998,"decision_tree":0.478,"bt":0.467,"ann":0.711,"blended":0.971}},{"game_id":"2002-W17-WAS-DAL","home_team":"WAS","away_team":"DAL","season":2002,"week":17,"actual":{"home_points":20,"away_points":14,"home_win":1},"predicted":{"logistic":0.948,"decision_tree":0.478,"bt":0.416,"ann":0.6,"blended":0.917}},{"game_id":"2002-W17-DEN-ARI","home_team":"DEN","away_team":"ARI","season":2002,"week":17,"actual":{"home_points":37,"away_points":7,"home_win":1},"predicted":{"logistic":0.786,"decision_tree":0.667,"bt":0.594,"ann":0.683,"blended":0.785}},{"game_id":"2002-W17-NYJ-GB","home_team":"NYJ","away_team":"GB","season":2002,"week":17,"actual":{"home_points":42,"away_points":17,"home_win":1},"predicted":{"logistic":0.999,"decision_tree":0.92,"bt":0.545,"ann":0.733,"blended":0.974}},{"game_id":"2002-W17-CHI-TB","home_team":"CHI","away_team":"TB","season":2002,"week":17,"actual":{"home_points":0,"away_points":15,"home_win":0},"predicted":{"logistic":0.012,"decision_tree":0.2,"bt":0.486,"ann":0.322,"blended":0.046}}]