[{"game_id":"2003-W16-TB-ATL","home_team":"TB","away_team":"ATL","season":2003,"week":16,"actual":{"home_points":28,"away_points":30,"home_win":0},"predicted":{"logistic":0.254,"decision_tree":0.773,"bt":0.515,"ann":0.533,"blended":0.309}},{"game_id":"2003-W16-MIN-KC","home_team":"MIN","away_team":"KC","season":2003,"week":16,"actual":{"home_points":45,"away_points":20,"home_win":1},"predicted":{"logistic":0.058,"decision_tree":0.915,"bt":0.518,"ann":0.474,"blended":0.112}},{"game_id":"2003-W16-NYJ-NE","home_team":"NYJ","away_team":"NE","season":2003,"week":16,"actual":{"home_points":16,"away_points":21,"home_win":0},"predicted":{"logistic":0.632,"decision_tree":0.915,"bt":0.62,"ann":0.317,"blended":0.632}},{"game_id":"2003-W16-BUF-MIA","home_team":"BUF","away_team":"MIA","season":2003,"week":16,"actual":{"home_points":3,"away_points":20,"home_win":0},"predicted":{"logistic":0.032,"decision_tree":0.273,"bt":0.718,"ann":0.588,"blended":0.098}},{"game_id":"2003-W16-CAR-DET","home_team":"CAR","away_team":"DET","season":2003,"week":16,"actual":{"home_points":20,"away_points":14,"home_win":1},"predicted":{"logistic":0.973,"decision_tree":0.915,"bt":0.764,"ann":0.629,"blended":0.946}},{"game_id":"2003-W16-CHI-WAS","home_team":"CHI","away_team":"WAS","season":2003,"week":16,"actual":{"home_points":27,"away_points":24,"home_win":1},"predicted":{"logistic":0.982,"decision_tree":0.915,"bt":0.585,"ann":0.534,"blended":0.945}},{"game_id":"2003-W16-CLE-BAL","home_team":"CLE","away_team":"BAL","season":2003,"week":16,"actual":{"home_points":0,"away_points":35,"home_win":0},"predicted":{"logistic":0.015,"decision_tree":0.273,"bt":0.579,"ann":0.229,"blended":0.041}},{"game_id":"2003-W16-DAL-NYG","home_team":"DAL","away_team":"NYG","season":2003,"week":16,"actual":{"home_points":19,"away_points":3,"home_win":1},"predicted":{"logistic":1,"decision_tree":0.915,"bt":0.551,"ann":0.771,"blended":0.98}},{"game_id":"2003-W16-HOU-TEN","home_team":"HOU","away_team":"TEN","season":2003,"week":16,"actual":{"home_points":24,"away_points":27,"home_win":0},"predicted":{"logistic":0.001,"decision_tree":0.286,"bt":0.493,"ann":0.232,"blended":0.027}},{"game_id":"2003-W16-PHI-SF","home_team":"PHI","away_team":"SF","season":2003,"week":16,"actual":{"home_points":28,"away_points":31,"home_win":0},"predicted":{"logistic":1,"decision_tree":0.915,"bt":0.434,"ann":0.791,"blended":0.982}},{"game_id":"2003-W16-SEA-ARI","home_team":"SEA","away_team":"ARI","season":2003,"week":16,"actual":{"home_points":28,"away_points":10,"home_win":1},"predicted":{"logistic":0.898,"decision_tree":0.915,"bt":0.537,"ann":0.586,"blended":0.882}},{"game_id":"2003-W16-IND-DEN","home_team":"IND","away_team":"DEN","season":2003,"week":16,"actual":{"home_points":17,"away_points":31,"home_win":0},"predicted":{"logistic":0.326,"decision_tree":0.773,"bt":0.581,"ann":0.561,"blended":0.38}}]