[{"game_id":"2009-W16-ATL-BUF","home_team":"ATL","away_team":"BUF","season":2009,"week":16,"actual":{"home_points":31,"away_points":3,"home_win":1},"predicted":{"logistic":0.813,"decision_tree":0.846,"bt":0.529,"ann":0.344,"blended":0.773}},{"game_id":"2009-W16-CIN-KC","home_team":"CIN","away_team":"KC","season":2009,"week":16,"actual":{"home_points":17,"away_points":10,"home_win":1},"predicted":{"logistic":0.673,"decision_tree":0.632,"bt":0.465,"ann":0.741,"blended":0.688}},{"game_id":"2009-W16-GB-SEA","home_team":"GB","away_team":"SEA","season":2009,"week":16,"actual":{"home_points":48,"away_points":10,"home_win":1},"predicted":{"logistic":0.999,"decision_tree":0.632,"bt":0.621,"ann":0.794,"blended":0.979}},{"game_id":"2009-W16-MIA-HOU","home_team":"MIA","away_team":"HOU","season":2009,"week":16,"actual":{"home_points":20,"away_points":27,"home_win":0},"predicted":{"logistic":0.059,"decision_tree":0.632,"bt":0.496,"ann":0.458,"blended":0.103}},{"game_id":"2009-W16-NO-TB","home_team":"NO","away_team":"TB","season":2009,"week":16,"actual":{"home_points":17,"away_points":20,"home_win":0},"predicted":{"logistic":0.997,"decision_tree":0.375,"bt":0.665,"ann":0.705,"blended":0.969}},{"game_id":"2009-W16-NYG-CAR","home_team":"NYG","away_team":"CAR","season":2009,"week":16,"actual":{"home_points":9,"away_points":41,"home_win":0},"predicted":{"logistic":0.042,"decision_tree":0.375,"bt":0.639,"ann":0.532,"blended":0.094}},{"game_id":"2009-W16-PIT-BAL","home_team":"PIT","away_team":"BAL","season":2009,"week":16,"actual":{"home_points":23,"away_points":20,"home_win":1},"predicted":{"logistic":0.004,"decision_tree":0.632,"bt":0.366,"ann":0.601,"blended":0.066}},{"game_id":"2009-W16-SF-DET","home_team":"SF","away_team":"DET","season":2009,"week":16,"actual":{"home_points":20,"away_points":6,"home_win":1},"predicted":{"logistic":0.971,"decision_tree":0.571,"bt":0.417,"ann":0.666,"blended":0.943}},{"game_id":"2009-W16-IND-NYJ","home_team":"IND","away_team":"NYJ","season":2009,"week":16,"actual":{"home_points":15,"away_points":29,"home_win":0},"predicted":{"logistic":0.976,"decision_tree":0.909,"bt":0.722,"ann":0.759,"blended":0.956}},{"game_id":"2009-W16-PHI-DEN","home_team":"PHI","away_team":"DEN","season":2009,"week":16,"actual":{"home_points":30,"away_points":27,"home_win":1},"predicted":{"logistic":0.979,"decision_tree":0.632,"bt":0.573,"ann":0.724,"blended":0.955}},{"game_id":"2009-W16-WAS-DAL","home_team":"WAS","away_team":"DAL","season":2009,"week":16,"actual":{"home_points":0,"away_points":17,"home_win":0},"predicted":{"logistic":0.025,"decision_tree":0.333,"bt":0.533,"ann":0.324,"blended":0.057}},{"game_id":"2009-W16-CHI-MIN","home_team":"CHI","away_team":"MIN","season":2009,"week":16,"actual":{"home_points":36,"away_points":30,"home_win":1},"predicted":{"logistic":0.028,"decision_tree":0.069,"bt":0.441,"ann":0.186,"blended":0.045}}]