[{"game_id":"2019-W18-HOU-BUF","home_team":"HOU","away_team":"BUF","season":2019,"week":18,"actual":{"home_points":22,"away_points":19,"home_win":1},"predicted":{"logistic":0.033,"decision_tree":0.462,"bt":0.4,"ann":0.172,"blended":0.04}},{"game_id":"2019-W18-NE-TEN","home_team":"NE","away_team":"TEN","season":2019,"week":18,"actual":{"home_points":13,"away_points":20,"home_win":0},"predicted":{"logistic":0.035,"decision_tree":0.158,"bt":0.573,"ann":0.582,"blended":0.077}},{"game_id":"2019-W18-NO-MIN","home_team":"NO","away_team":"MIN","season":2019,"week":18,"actual":{"home_points":20,"away_points":26,"home_win":0},"predicted":{"logistic":0.614,"decision_tree":0.839,"bt":0.401,"ann":0.827,"blended":0.596}},{"game_id":"2019-W18-PHI-SEA","home_team":"PHI","away_team":"SEA","season":2019,"week":18,"actual":{"home_points":9,"away_points":17,"home_win":0},"predicted":{"logistic":0.976,"decision_tree":0.839,"bt":0.365,"ann":0.758,"blended":0.946}}]