[{"game_id":"2008-W07-CAR-NO","home_team":"CAR","away_team":"NO","season":2008,"week":7,"actual":{"home_points":30,"away_points":7,"home_win":1},"predicted":{"logistic":1,"decision_tree":0.8,"bt":0.601,"ann":0.659,"blended":0.972}},{"game_id":"2008-W07-CHI-MIN","home_team":"CHI","away_team":"MIN","season":2008,"week":7,"actual":{"home_points":48,"away_points":41,"home_win":1},"predicted":{"logistic":0.998,"decision_tree":0.8,"bt":0.435,"ann":0.676,"blended":0.972}},{"game_id":"2008-W07-CIN-PIT","home_team":"CIN","away_team":"PIT","season":2008,"week":7,"actual":{"home_points":10,"away_points":38,"home_win":0},"predicted":{"logistic":0.001,"decision_tree":0.148,"bt":0.486,"ann":0.294,"blended":0.037}},{"game_id":"2008-W07-KC-TEN","home_team":"KC","away_team":"TEN","season":2008,"week":7,"actual":{"home_points":10,"away_points":34,"home_win":0},"predicted":{"logistic":0.38,"decision_tree":0.148,"bt":0.414,"ann":0.335,"blended":0.425}},{"game_id":"2008-W07-MIA-BAL","home_team":"MIA","away_team":"BAL","season":2008,"week":7,"actual":{"home_points":13,"away_points":27,"home_win":0},"predicted":{"logistic":0.051,"decision_tree":0.333,"bt":0.564,"ann":0.603,"blended":0.127}},{"game_id":"2008-W07-NYG-SF","home_team":"NYG","away_team":"SF","season":2008,"week":7,"actual":{"home_points":29,"away_points":17,"home_win":1},"predicted":{"logistic":0.833,"decision_tree":0.902,"bt":0.591,"ann":0.689,"blended":0.847}},{"game_id":"2008-W07-HOU-DET","home_team":"HOU","away_team":"DET","season":2008,"week":7,"actual":{"home_points":28,"away_points":21,"home_win":1},"predicted":{"logistic":0.988,"decision_tree":0.583,"bt":0.511,"ann":0.54,"blended":0.953}},{"game_id":"2008-W07-GB-IND","home_team":"GB","away_team":"IND","season":2008,"week":7,"actual":{"home_points":34,"away_points":14,"home_win":1},"predicted":{"logistic":0.98,"decision_tree":0.583,"bt":0.577,"ann":0.718,"blended":0.962}},{"game_id":"2008-W07-WAS-CLE","home_team":"WAS","away_team":"CLE","season":2008,"week":7,"actual":{"home_points":14,"away_points":11,"home_win":1},"predicted":{"logistic":0.396,"decision_tree":0.583,"bt":0.581,"ann":0.587,"blended":0.465}},{"game_id":"2008-W07-TB-SEA","home_team":"TB","away_team":"SEA","season":2008,"week":7,"actual":{"home_points":20,"away_points":10,"home_win":1},"predicted":{"logistic":1,"decision_tree":0.583,"bt":0.547,"ann":0.74,"blended":0.979}},{"game_id":"2008-W07-NE-DEN","home_team":"NE","away_team":"DEN","season":2008,"week":7,"actual":{"home_points":41,"away_points":7,"home_win":1},"predicted":{"logistic":0.99,"decision_tree":0.902,"bt":0.492,"ann":0.618,"blended":0.961}}]