[{"game_id":"2025-W14-DET-DAL","home_team":"DET","away_team":"DAL","season":2025,"week":14,"actual":{"home_points":44,"away_points":30,"home_win":1},"predicted":{"logistic":0.07,"decision_tree":0.29,"bt":0.516,"ann":0.341,"blended":0.159}},{"game_id":"2025-W14-ATL-SEA","home_team":"ATL","away_team":"SEA","season":2025,"week":14,"actual":{"home_points":9,"away_points":37,"home_win":0},"predicted":{"logistic":0.083,"decision_tree":0.204,"bt":0.952,"ann":0.531,"blended":0.16}},{"game_id":"2025-W14-BAL-PIT","home_team":"BAL","away_team":"PIT","season":2025,"week":14,"actual":{"home_points":22,"away_points":27,"home_win":0},"predicted":{"logistic":0.972,"decision_tree":0.477,"bt":0.711,"ann":0.793,"blended":0.8}},{"game_id":"2025-W14-BUF-CIN","home_team":"BUF","away_team":"CIN","season":2025,"week":14,"actual":{"home_points":39,"away_points":34,"home_win":1},"predicted":{"logistic":0.351,"decision_tree":0.722,"bt":0.239,"ann":0.306,"blended":0.45}},{"game_id":"2025-W14-CLE-TEN","home_team":"CLE","away_team":"TEN","season":2025,"week":14,"actual":{"home_points":29,"away_points":31,"home_win":0},"predicted":{"logistic":0.515,"decision_tree":0.397,"bt":0.666,"ann":0.493,"blended":0.47}},{"game_id":"2025-W14-MIN-WAS","home_team":"MIN","away_team":"WAS","season":2025,"week":14,"actual":{"home_points":31,"away_points":0,"home_win":1},"predicted":{"logistic":0.002,"decision_tree":0.273,"bt":0.653,"ann":0.101,"blended":0.09}},{"game_id":"2025-W14-NYJ-MIA","home_team":"NYJ","away_team":"MIA","season":2025,"week":14,"actual":{"home_points":10,"away_points":34,"home_win":0},"predicted":{"logistic":0.87,"decision_tree":0.707,"bt":0.288,"ann":0.374,"blended":0.765}},{"game_id":"2025-W14-TB-NO","home_team":"TB","away_team":"NO","season":2025,"week":14,"actual":{"home_points":20,"away_points":24,"home_win":0},"predicted":{"logistic":0.007,"decision_tree":0.29,"bt":0.944,"ann":0.233,"blended":0.111}},{"game_id":"2025-W14-LV-DEN","home_team":"LV","away_team":"DEN","season":2025,"week":14,"actual":{"home_points":17,"away_points":24,"home_win":0},"predicted":{"logistic":0.004,"decision_tree":0.002,"bt":0.942,"ann":0.112,"blended":0.014}},{"game_id":"2025-W14-GB-CHI","home_team":"GB","away_team":"CHI","season":2025,"week":14,"actual":{"home_points":28,"away_points":21,"home_win":1},"predicted":{"logistic":0.698,"decision_tree":0.722,"bt":0.808,"ann":0.41,"blended":0.669}},{"game_id":"2025-W14-KC-HOU","home_team":"KC","away_team":"HOU","season":2025,"week":14,"actual":{"home_points":10,"away_points":20,"home_win":0},"predicted":{"logistic":0.182,"decision_tree":0.29,"bt":0.748,"ann":0.179,"blended":0.209}},{"game_id":"2025-W14-LAC-PHI","home_team":"LAC","away_team":"PHI","season":2025,"week":14,"actual":{"home_points":22,"away_points":19,"home_win":1},"predicted":{"logistic":0.068,"decision_tree":0.858,"bt":0.315,"ann":0.269,"blended":0.318}}]