[
  {
    "game_id": "2021-W03-HOU-CAR",
    "home_team": "HOU",
    "away_team": "CAR",
    "season": 2021,
    "week": 3,
    "actual": {
      "home_points": 9,
      "away_points": 24,
      "home_win": 0
    },
    "predicted": {
      "logistic": 0.148,
      "decision_tree": 0.667,
      "bt": 0.968,
      "ann": 0.5,
      "blended": 0.385
    }
  },
  {
    "game_id": "2021-W03-BUF-WAS",
    "home_team": "BUF",
    "away_team": "WAS",
    "season": 2021,
    "week": 3,
    "actual": {
      "home_points": 43,
      "away_points": 21,
      "home_win": 1
    },
    "predicted": {
      "logistic": 1,
      "decision_tree": 0.667,
      "bt": 0.094,
      "ann": 0.5,
      "blended": 0.879
    }
  },
  {
    "game_id": "2021-W03-CLE-CHI",
    "home_team": "CLE",
    "away_team": "CHI",
    "season": 2021,
    "week": 3,
    "actual": {
      "home_points": 26,
      "away_points": 6,
      "home_win": 1
    },
    "predicted": {
      "logistic": 0.999,
      "decision_tree": 0.667,
      "bt": 0.443,
      "ann": 0.5,
      "blended": 0.879
    }
  },
  {
    "game_id": "2021-W03-DET-BAL",
    "home_team": "DET",
    "away_team": "BAL",
    "season": 2021,
    "week": 3,
    "actual": {
      "home_points": 17,
      "away_points": 19,
      "home_win": 0
    },
    "predicted": {
      "logistic": 0.396,
      "decision_tree": 0.261,
      "bt": 0.508,
      "ann": 0.5,
      "blended": 0.369
    }
  },
  {
    "game_id": "2021-W03-JAX-ARI",
    "home_team": "JAX",
    "away_team": "ARI",
    "season": 2021,
    "week": 3,
    "actual": {
      "home_points": 19,
      "away_points": 31,
      "home_win": 0
    },
    "predicted": {
      "logistic": 0.009,
      "decision_tree": 0.261,
      "bt": 0,
      "ann": 0.5,
      "blended": 0.123
    }
  },
  {
    "game_id": "2021-W03-KC-LAC",
    "home_team": "KC",
    "away_team": "LAC",
    "season": 2021,
    "week": 3,
    "actual": {
      "home_points": 24,
      "away_points": 30,
      "home_win": 0
    },
    "predicted": {
      "logistic": 0.334,
      "decision_tree": 0.667,
      "bt": 0.999,
      "ann": 0.5,
      "blended": 0.498
    }
  },
  {
    "game_id": "2021-W03-NE-NO",
    "home_team": "NE",
    "away_team": "NO",
    "season": 2021,
    "week": 3,
    "actual": {
      "home_points": 13,
      "away_points": 28,
      "home_win": 0
    },
    "predicted": {
      "logistic": 0.853,
      "decision_tree": 0.667,
      "bt": 0.971,
      "ann": 0.5,
      "blended": 0.798
    }
  },
  {
    "game_id": "2021-W03-NYG-ATL",
    "home_team": "NYG",
    "away_team": "ATL",
    "season": 2021,
    "week": 3,
    "actual": {
      "home_points": 14,
      "away_points": 17,
      "home_win": 0
    },
    "predicted": {
      "logistic": 0.278,
      "decision_tree": 0.261,
      "bt": 0.987,
      "ann": 0.5,
      "blended": 0.296
    }
  },
  {
    "game_id": "2021-W03-PIT-CIN",
    "home_team": "PIT",
    "away_team": "CIN",
    "season": 2021,
    "week": 3,
    "actual": {
      "home_points": 10,
      "away_points": 24,
      "home_win": 0
    },
    "predicted": {
      "logistic": 0.42,
      "decision_tree": 0.667,
      "bt": 0.901,
      "ann": 0.5,
      "blended": 0.55
    }
  },
  {
    "game_id": "2021-W03-TEN-IND",
    "home_team": "TEN",
    "away_team": "IND",
    "season": 2021,
    "week": 3,
    "actual": {
      "home_points": 25,
      "away_points": 16,
      "home_win": 1
    },
    "predicted": {
      "logistic": 0.99,
      "decision_tree": 0.667,
      "bt": 0.479,
      "ann": 0.5,
      "blended": 0.874
    }
  },
  {
    "game_id": "2021-W03-DEN-NYJ",
    "home_team": "DEN",
    "away_team": "NYJ",
    "season": 2021,
    "week": 3,
    "actual": {
      "home_points": 26,
      "away_points": 0,
      "home_win": 1
    },
    "predicted": {
      "logistic": 1,
      "decision_tree": 0.5,
      "bt": 1,
      "ann": 0.5,
      "blended": 0.818
    }
  },
  {
    "game_id": "2021-W03-LV-MIA",
    "home_team": "LV",
    "away_team": "MIA",
    "season": 2021,
    "week": 3,
    "actual": {
      "home_points": 31,
      "away_points": 28,
      "home_win": 1
    },
    "predicted": {
      "logistic": 1,
      "decision_tree": 0.5,
      "bt": 1,
      "ann": 0.5,
      "blended": 0.818
    }
  },
  {
    "game_id": "2021-W03-LA-TB",
    "home_team": "LA",
    "away_team": "TB",
    "season": 2021,
    "week": 3,
    "actual": {
      "home_points": 34,
      "away_points": 24,
      "home_win": 1
    },
    "predicted": {
      "logistic": 0.997,
      "decision_tree": 0.5,
      "bt": 0.99,
      "ann": 0.5,
      "blended": 0.816
    }
  },
  {
    "game_id": "2021-W03-MIN-SEA",
    "home_team": "MIN",
    "away_team": "SEA",
    "season": 2021,
    "week": 3,
    "actual": {
      "home_points": 30,
      "away_points": 17,
      "home_win": 1
    },
    "predicted": {
      "logistic": 0.992,
      "decision_tree": 0.667,
      "bt": 0.199,
      "ann": 0.5,
      "blended": 0.875
    }
  },
  {
    "game_id": "2021-W03-SF-GB",
    "home_team": "SF",
    "away_team": "GB",
    "season": 2021,
    "week": 3,
    "actual": {
      "home_points": 28,
      "away_points": 30,
      "home_win": 0
    },
    "predicted": {
      "logistic": 0.282,
      "decision_tree": 0.5,
      "bt": 1,
      "ann": 0.5,
      "blended": 0.398
    }
  },
  {
    "game_id": "2021-W03-DAL-PHI",
    "home_team": "DAL",
    "away_team": "PHI",
    "season": 2021,
    "week": 3,
    "actual": {
      "home_points": 41,
      "away_points": 21,
      "home_win": 1
    },
    "predicted": {
      "logistic": 0.999,
      "decision_tree": 0.667,
      "bt": 0,
      "ann": 0.5,
      "blended": 0.879
    }
  }
]