[{"game_id":"2007-W14-WAS-CHI","home_team":"WAS","away_team":"CHI","season":2007,"week":14,"actual":{"home_points":24,"away_points":16,"home_win":1},"predicted":{"logistic":0.121,"decision_tree":0.074,"bt":0.674,"ann":0.481,"blended":0.153}},{"game_id":"2007-W14-BUF-MIA","home_team":"BUF","away_team":"MIA","season":2007,"week":14,"actual":{"home_points":38,"away_points":17,"home_win":1},"predicted":{"logistic":0.999,"decision_tree":0.914,"bt":0.583,"ann":0.506,"blended":0.939}},{"game_id":"2007-W14-DET-DAL","home_team":"DET","away_team":"DAL","season":2007,"week":14,"actual":{"home_points":27,"away_points":28,"home_win":0},"predicted":{"logistic":0.001,"decision_tree":0.074,"bt":0.547,"ann":0.373,"blended":0.05}},{"game_id":"2007-W14-HOU-TB","home_team":"HOU","away_team":"TB","season":2007,"week":14,"actual":{"home_points":28,"away_points":14,"home_win":1},"predicted":{"logistic":0.508,"decision_tree":0.074,"bt":0.362,"ann":0.408,"blended":0.439}},{"game_id":"2007-W14-PHI-NYG","home_team":"PHI","away_team":"NYG","season":2007,"week":14,"actual":{"home_points":13,"away_points":16,"home_win":0},"predicted":{"logistic":0.185,"decision_tree":0.074,"bt":0.631,"ann":0.475,"blended":0.201}},{"game_id":"2007-W14-SEA-ARI","home_team":"SEA","away_team":"ARI","season":2007,"week":14,"actual":{"home_points":42,"away_points":21,"home_win":1},"predicted":{"logistic":0.998,"decision_tree":0.914,"bt":0.669,"ann":0.709,"blended":0.958}},{"game_id":"2007-W14-SF-MIN","home_team":"SF","away_team":"MIN","season":2007,"week":14,"actual":{"home_points":7,"away_points":27,"home_win":0},"predicted":{"logistic":0,"decision_tree":0.074,"bt":0.19,"ann":0.454,"blended":0.058}},{"game_id":"2007-W14-DEN-KC","home_team":"DEN","away_team":"KC","season":2007,"week":14,"actual":{"home_points":41,"away_points":7,"home_win":1},"predicted":{"logistic":0.986,"decision_tree":0.914,"bt":0.579,"ann":0.615,"blended":0.939}},{"game_id":"2007-W14-NE-PIT","home_team":"NE","away_team":"PIT","season":2007,"week":14,"actual":{"home_points":34,"away_points":13,"home_win":1},"predicted":{"logistic":0.594,"decision_tree":0.956,"bt":0.684,"ann":0.704,"blended":0.665}},{"game_id":"2007-W14-NYJ-CLE","home_team":"NYJ","away_team":"CLE","season":2007,"week":14,"actual":{"home_points":18,"away_points":24,"home_win":0},"predicted":{"logistic":0.979,"decision_tree":0.914,"bt":0.529,"ann":0.644,"blended":0.937}},{"game_id":"2007-W14-BAL-IND","home_team":"BAL","away_team":"IND","season":2007,"week":14,"actual":{"home_points":20,"away_points":44,"home_win":0},"predicted":{"logistic":0,"decision_tree":0.05,"bt":0.567,"ann":0.413,"blended":0.05}},{"game_id":"2007-W14-ATL-NO","home_team":"ATL","away_team":"NO","season":2007,"week":14,"actual":{"home_points":14,"away_points":34,"home_win":0},"predicted":{"logistic":0.07,"decision_tree":0.6,"bt":0.284,"ann":0.457,"blended":0.192}}]