[{"game_id":"2016-W14-BUF-PIT","home_team":"BUF","away_team":"PIT","season":2016,"week":14,"actual":{"home_points":20,"away_points":27,"home_win":0},"predicted":{"logistic":0.235,"decision_tree":0.2,"bt":0.405,"ann":0.458,"blended":0.281}},{"game_id":"2016-W14-CLE-CIN","home_team":"CLE","away_team":"CIN","season":2016,"week":14,"actual":{"home_points":10,"away_points":23,"home_win":0},"predicted":{"logistic":0.998,"decision_tree":0.057,"bt":0.563,"ann":0.371,"blended":0.817}},{"game_id":"2016-W14-DET-CHI","home_team":"DET","away_team":"CHI","season":2016,"week":14,"actual":{"home_points":20,"away_points":17,"home_win":1},"predicted":{"logistic":0.852,"decision_tree":0.831,"bt":0.605,"ann":0.575,"blended":0.842}},{"game_id":"2016-W14-IND-HOU","home_team":"IND","away_team":"HOU","season":2016,"week":14,"actual":{"home_points":17,"away_points":22,"home_win":0},"predicted":{"logistic":0.499,"decision_tree":0.933,"bt":0.832,"ann":0.565,"blended":0.606}},{"game_id":"2016-W14-MIA-ARI","home_team":"MIA","away_team":"ARI","season":2016,"week":14,"actual":{"home_points":26,"away_points":23,"home_win":1},"predicted":{"logistic":0.971,"decision_tree":0.831,"bt":0.68,"ann":0.627,"blended":0.926}},{"game_id":"2016-W14-PHI-WAS","home_team":"PHI","away_team":"WAS","season":2016,"week":14,"actual":{"home_points":22,"away_points":27,"home_win":0},"predicted":{"logistic":0.008,"decision_tree":0.087,"bt":0.558,"ann":0.443,"blended":0.073}},{"game_id":"2016-W14-TEN-DEN","home_team":"TEN","away_team":"DEN","season":2016,"week":14,"actual":{"home_points":13,"away_points":10,"home_win":1},"predicted":{"logistic":0.849,"decision_tree":0.831,"bt":0.775,"ann":0.557,"blended":0.838}},{"game_id":"2016-W14-SF-NYJ","home_team":"SF","away_team":"NYJ","season":2016,"week":14,"actual":{"home_points":17,"away_points":23,"home_win":0},"predicted":{"logistic":0.324,"decision_tree":0.057,"bt":0.632,"ann":0.248,"blended":0.306}},{"game_id":"2016-W14-GB-SEA","home_team":"GB","away_team":"SEA","season":2016,"week":14,"actual":{"home_points":38,"away_points":10,"home_win":1},"predicted":{"logistic":0.221,"decision_tree":0.933,"bt":0.585,"ann":0.5,"blended":0.39}},{"game_id":"2016-W14-TB-NO","home_team":"TB","away_team":"NO","season":2016,"week":14,"actual":{"home_points":16,"away_points":11,"home_win":1},"predicted":{"logistic":0.946,"decision_tree":0.2,"bt":0.45,"ann":0.723,"blended":0.833}},{"game_id":"2016-W14-NYG-DAL","home_team":"NYG","away_team":"DAL","season":2016,"week":14,"actual":{"home_points":10,"away_points":7,"home_win":1},"predicted":{"logistic":0.945,"decision_tree":0.831,"bt":0.464,"ann":0.693,"blended":0.914}},{"game_id":"2016-W14-NE-BAL","home_team":"NE","away_team":"BAL","season":2016,"week":14,"actual":{"home_points":30,"away_points":23,"home_win":1},"predicted":{"logistic":0.084,"decision_tree":0.831,"bt":0.561,"ann":0.735,"blended":0.29}}]