[{"game_id":"2012-W10-CAR-DEN","home_team":"CAR","away_team":"DEN","season":2012,"week":10,"actual":{"home_points":14,"away_points":36,"home_win":0},"predicted":{"logistic":0.807,"decision_tree":0.118,"bt":0.463,"ann":0.205,"blended":0.761}},{"game_id":"2012-W10-CIN-NYG","home_team":"CIN","away_team":"NYG","season":2012,"week":10,"actual":{"home_points":31,"away_points":13,"home_win":1},"predicted":{"logistic":0.991,"decision_tree":0.818,"bt":0.537,"ann":0.77,"blended":0.971}},{"game_id":"2012-W10-MIA-TEN","home_team":"MIA","away_team":"TEN","season":2012,"week":10,"actual":{"home_points":3,"away_points":37,"home_win":0},"predicted":{"logistic":0.601,"decision_tree":0.286,"bt":0.37,"ann":0.636,"blended":0.622}},{"game_id":"2012-W10-MIN-DET","home_team":"MIN","away_team":"DET","season":2012,"week":10,"actual":{"home_points":34,"away_points":24,"home_win":1},"predicted":{"logistic":0.686,"decision_tree":0.5,"bt":0.51,"ann":0.263,"blended":0.661}},{"game_id":"2012-W10-NE-BUF","home_team":"NE","away_team":"BUF","season":2012,"week":10,"actual":{"home_points":37,"away_points":31,"home_win":1},"predicted":{"logistic":0.99,"decision_tree":0.951,"bt":0.714,"ann":0.823,"blended":0.976}},{"game_id":"2012-W10-NO-ATL","home_team":"NO","away_team":"ATL","season":2012,"week":10,"actual":{"home_points":31,"away_points":27,"home_win":1},"predicted":{"logistic":1,"decision_tree":0.951,"bt":0.62,"ann":0.645,"blended":0.967}},{"game_id":"2012-W10-SEA-NYJ","home_team":"SEA","away_team":"NYJ","season":2012,"week":10,"actual":{"home_points":28,"away_points":7,"home_win":1},"predicted":{"logistic":0.991,"decision_tree":0.4,"bt":0.523,"ann":0.34,"blended":0.931}},{"game_id":"2012-W10-PHI-DAL","home_team":"PHI","away_team":"DAL","season":2012,"week":10,"actual":{"home_points":23,"away_points":38,"home_win":0},"predicted":{"logistic":0.014,"decision_tree":0.118,"bt":0.582,"ann":0.263,"blended":0.042}},{"game_id":"2012-W10-CHI-HOU","home_team":"CHI","away_team":"HOU","season":2012,"week":10,"actual":{"home_points":6,"away_points":13,"home_win":0},"predicted":{"logistic":0.014,"decision_tree":0.4,"bt":0.173,"ann":0.687,"blended":0.087}},{"game_id":"2012-W10-PIT-KC","home_team":"PIT","away_team":"KC","season":2012,"week":10,"actual":{"home_points":16,"away_points":13,"home_win":1},"predicted":{"logistic":0.996,"decision_tree":0.951,"bt":0.802,"ann":0.721,"blended":0.971}}]